{
    "coverage": {
        "US Census": {
            "geoid": "12111",
            "name": "St. Lucie County",
            "state": "Florida"
        },
        "country": "us",
        "state": "fl",
        "county": "St. Lucie"
    },
    "data": "http://www.stlucieco.gov/home/showdocument?id=2739",
    "type": "http",
    "compression": "zip",
    "conform": {
        "number": "StreetNumb",
        "street": "StreetLabe",
        "unit": "AptSuite",
        "city": "City",
        "postcode": "ZipCode",
        "type": "shapefile",
        "file": "AddressMaster.shp"
    }
}
