{
    "coverage": {
        "US Census": {
            "geoid": "37161",
            "name": "Rutherford County",
            "state": "North Carolina"
        },
        "country": "us",
        "state": "nc",
        "county": "Rutherford"
    },
    "data": "http://arcgis.webgis.net/arcgis/rest/services/NC/Rutherford/MapServer/4",
    "license": "Indemnification",
    "type": "ESRI"
}