{
    "coverage": {
        "country": "ca",
        "state": "on",
        "city": "Burlington"
    },
    "data": "http://cms.burlington.ca/AssetFactory.aspx?did=30050",
    "website": "http://cms.burlington.ca/Page12956.aspx",
    "license": "http://cms.burlington.ca/AssetFactory.aspx?did=18762",
    "type": "http",
    "compression": "zip",
    "conform": {
        "merge": [
            "street",
            "strtype"
        ],
        "lon": "x",
        "lat": "y",
        "number": "housenum",
        "street": "auto_street",
        "type": "shapefile"
    }
}