{
    "coverage": {
        "US Census": {
            "geoid": "39157",
            "name": "Tuscarawas County",
            "state": "Ohio"
        },
        "country": "us",
        "state": "oh",
        "county": "Tuscarawas"
    },
    "data": "http://gis3.oit.ohio.gov/LBRS/_downloads/TUS_ADDS.zip",
    "type": "http",
    "compression": "zip",
    "conform": {
        "merge": [
            "STR_NAME",
            "STR_TYPE"
        ],
        "lon": "x",
        "lat": "y",
        "number": "ADDR_NUM",
        "street": "auto_street",
        "type": "shapefile",
        "postcode": "zip"
    }
}