{
    "coverage": {
        "US Census": {
            "geoid": "39045",
            "name": "Fairfield County",
            "state": "Ohio"
        },
        "country": "us",
        "state": "oh",
        "county": "Fairfield"
    },
    "data": "http://gis3.oit.ohio.gov/LBRS/_downloads/FAI_ADDS.zip",
    "type": "http",
    "compression": "zip",
    "conform": {
        "merge": [
            "NAME",
            "TYPE"
        ],
        "lon": "x",
        "lat": "y",
        "number": "HOUSENUM",
        "street": "auto_street",
        "type": "shapefile"
    }
}