{
    "coverage": {
        "US Census": {
            "geoid": "55045",
            "name": "Green County",
            "state": "Wisconsin"
        },
        "country": "us",
        "state": "wi",
        "county": "Green"
    },
    "data": "http://landrecords.greencountywi.org/arcgis/rest/services/GreenCo_GIS/MapServer/1",
    "type": "ESRI",
    "conform": {
        "lon": "x",
        "lat": "y",
        "number": "numb",
        "street": "street",
        "type": "geojson"
    }
}