{
    "coverage": {
        "ISO 3166": {
            "alpha2": "TW-ILA",
            "country": "Taiwan"
        },
        "country": "tw"
    },
    "data": "http://ja.miaoli.gov.tw/arcgis/rest/services/Miaoli/miaoliDpDynamic_B/FeatureServer/1",
    "type": "ESRI",
    "language": "zh",
    "conform": {
        "type": "geojson",
        "number": {
          "function": "remove_prefix",
            "field": "ADDRESSALL",
            "field_to_remove": "ROAD"
        },
        "street": {
            "function": "join",
            "fields": ["ROAD","LANE","ALLEY"],
            "separator": ""
        },
        "city": "VILLAGE",
        "district": "TOWNN"
    }
}
