{
    "coverage": {
        "US Census": {
            "geoid": "1342425",
            "name": "City of John's Creek",
            "state": "ga"
        },
        "country": "us",
        "state": "ga",
        "county": "Fulton",
        "city": "John's Creek"
    },
    "data": "https://services1.arcgis.com/bqfNVPUK3HOnCFmA/arcgis/rest/services/Address_Points/FeatureServer/0",
    "type": "ESRI",
    "conform": {
        "type": "geojson",
        "number": "StNumber",
        "street": [
            "PreMod",
            "PreDir",
            "PreType",
            "Name",
            "PostType",
            "PostDir",
            "PostMod"
        ],
        "unit": "UnitActual",
        "city": "City",
        "region": "State",
        "postcode": "Zip"
    }
}
