{
    "coverage": {
        "US Census": {
            "geoid": "12095",
            "name": "Orange County",
            "state": "Florida"
        },
        "country": "us",
        "state": "fl",
        "county": "Orange"
    },
    "attribution": "Orange County",
    "data": "ftp://ftp.onetgov.net/divisions/Infomap/pub/GIS_Downloads/FTP Shapefiles/Address Points.zip",
    "license": "Public Domain",
    "type": "ftp",
    "compression": "zip",
    "conform": {
        "type": "shapefile",
        "number": "ADDRESS__1",
        "street": "COMPLETE_S",
        "city": "MUNICIPAL_",
        "postcode": "ZIPCODE"
    }
}
