{
    "coverage": {
        "US Census": {
            "geoid": "18057",
            "name": "Hamilton County",
            "state": "Indiana"
        },
        "country": "us",
        "state": "in",
        "county": "Hamilton"
    },
    "data": "http://gis.hamiltoncounty.in.gov/ArcGIS/rest/services/E911/MapServer/0",
    "type": "ESRI",
    "conform": {
        "merge": [
            "loc_st",
            "loc_st_suf"
        ],
        "lon": "x",
        "lat": "y",
        "number": "loc_no",
        "street": "auto_street",
        "type": "geojson",
        "postcode": "loc_zip"
    }
}