{
    "coverage": {
        "US Census": {
            "geoid": "51057",
            "name": "Essex County",
            "state": "Virginia"
        },
        "country": "us",
        "state": "va",
        "county": "Essex"
    },
    "data": "http://vcloud.timmons.com/ArcGIS/rest/services/EssexWebLogistics/Essex_Main/MapServer/8",
    "type": "ESRI",
    "conform": {
        "number": "ADDRNUM",
        "street": "FULLNAME",
        "type": "geojson",
        "postcode": "zip"
    }
}