{
    "coverage": {
        "US Census": {
            "geoid": "06031",
            "name": "Kings County",
            "state": "California"
        },
        "country": "us",
        "state": "ca",
        "county": "Kings"
    },
    "conform": {
        "type": "geojson",
        "number": "STREET_NBR",
        "street": [
            "STREET_DIR",
            "STREET_NAM",
            "STREET_TYP"
        ],
        "city": "COMMUNITY",
        "postcode": "ZIPCODE"
    },
    "attribution": "Kings County",
    "data": "http://maps.co.kern.ca.us/arcgis/rest/services/Kings_base5all/MapServer/113",
    "type": "ESRI"
}
