{
    "coverage": {
        "US Census": {"geoid": "37041", "name": "Chowan County", "state": "North Carolina"},
        "country": "us",
        "state": "nc",
        "county": "Chowan"
    },
    "data": "",
    "type": "http",
    "compression": "zip",
    "website": "http://data.nconemap.gov/downloads/vector/parcels/Chowan_parcels_2017_10_26.zip",
    "conform": {
        "type": "shapefile",
        "file": "nc_chowan_parcels_pt_2017_10_26.shp",
        "id": "PARNO",
        "number": {
            "function": "prefixed_number",
            "field": "SITEADD"
        },
        "street": {
            "function": "postfixed_street",
            "field": "SITEADD"
        }
    }
}

