{
    "coverage": {
        "country": "us",
        "state": "ct",
        "city": "Trumbull"
    },
    "data": "https://gis.gbrct.org:6443/arcgis/rest/services/Trumbull/Trumbull_Parcels_NAD83/MapServer/4",
    "website": "http://www.trumbull-ct.gov/",
    "type": "ESRI",
    "conform": {
        "type": "geojson",
        "split": "Location",
        "number": "ST_NUM",
        "street": "auto_street",
        "id": "PAR_ID",
        "accuracy": 2
    }
}
