{
    "coverage": {
        "country": "us",
        "state": "va",
        "city": "Emporia"
    },
    "data": "http://gis.worldviewsolutions.com/arcgis/rest/services/emporia/main/MapServer/8",
    "type": "ESRI",
    "conform": {
        "lon": "x",
        "lat": "y",
        "number": "str_num",
        "street": "str_name",
        "type": "geojson"
    }
}