{
    "coverage": {
      "country": "us",
      "state": "hi",
      "county": "honolulu",
      "city": "honolulu"
    },
    "attribution": "City of Honolulu",
    "data": "https://www.dropbox.com/s/94da2ic6a5c2j50/us-hi-honolulu.zip?dl=0",
    "website": "ftp://gisftp.hicentral.com/Layers/Cadastral/",
    "license": "",
    "year": "2012",
    "type": "http",
    "compression": "zip",
    "note": "Includes full parcel shapefile of the island of Oahu. SRS is EPSG: 2784 "
}
