{
    "coverage": {
        "US Census": {
            "geoid": "06053",
            "name": "Monterey County",
            "state": "California"
        },
        "country": "us",
        "state": "ca",
        "county": "Monterey"
    },
    "attribution": "Monterey County",
    "data": "http://montereycountyopendata.montereyco.opendata.arcgis.com/datasets/02d744cef89148c6947ef704abbff753_0.geojson",
    "website": "http://montereycountyopendata.montereyco.opendata.arcgis.com/datasets/02d744cef89148c6947ef704abbff753_0",
    "license": "http://montereycountyopendata.montereyco.opendata.arcgis.com/datasets/02d744cef89148c6947ef704abbff753_0",
    "type": "http",
    "year": "2014",
    "note": "Download at that URL can be slow"
}
