{
    "coverage": {
        "US Census": {
            "geoid": "55087",
            "name": "Outagamie County",
            "state": "Wisconsin"
        },
        "country": "us",
        "state": "wi",
        "county": "Outagamie"
    },
    "data": "ftp://FTPGISWEBREAD:ftpgiswebread@ftp.co.outagamie.wi.us/AddressPointsSHAPE.zip",
    "type": "ftp",
    "compression": "zip",
    "skip": true
}