{
    "coverage": {
        "country": "us",
        "state": "wi",
        "city": "Milwaukee"
    },
    "type": "ESRI",
    "data": "http://maps.milwaukee.gov/ArcGIS/rest/services/LMS/LMS_APO/MapServer/1",
    "conform": {
        "type": "geojson",
        "numnber": "HSE_NBR",
        "street": [
            "DIR",
            "STREET",
            "STTYPE"
        ],
        "postcode": "ZIP_CODE",
        "city": "CITY"
    }
}
