{
    "coverage": {
        "country": "co",
        "region": "ant",
        "city": "Medell√≠n",
        "geometry": { "type": "Point", "coordinates": [-75.59, 6.23] }
    },
    "data": "https://www.medellin.gov.co/arcgis/rest/services/ServiciosPlaneacion/Pot_base1/MapServer/0",
    "website": "https://www.medellin.gov.co/geomedellin/",
    "type": "ESRI",
    "conform": {
        "type": "geojson",
        "number": "PLACA",
        "street": ["TIPO_VIA", "NUMERO_VIA", "APENDICE_VIA"]
    }
}
