{
    "coverage": {
        "US Census": {
            "geoid": "37199",
            "name": "Yancey County",
            "state": "North Carolina"
        },
        "country": "us",
        "state": "nc",
        "county": "Yancey"
    },
    "data": "http://web1.mobile311.com/arcgis/rest/services/NorthCarolina/Yancey/MapServer/32",
    "type": "ESRI",
    "conform": {
        "type": "geojson",
        "number": "STREET_NUM",
        "street": "STREET_NAM"
    }
}
