{
    "coverage": {
        "country": "us",
        "state": "va",
        "city": "Alexandria"
    },
    "data": "http://maps.alexandriava.gov/alexmaps/rest/services/alxBasemapWm/MapServer/0",
    "type": "ESRI",
    "website": "https://www.alexandriava.gov/gis/info/default.aspx?id=7654",
    "conform": {
        "lon": "x",
        "lat": "y",
        "split": "FULL_ADDS",
        "street": "auto_street",
        "number": "auto_number",
        "type": "geojson"
    }
}