{
    "coverage": {
        "US Census": {
            "geoid": "39117",
            "name": "Morrow County",
            "state": "Ohio"
        },
        "country": "us",
        "state": "oh",
        "county": "Morrow"
    },
    "data": "http://gis3.oit.ohio.gov/LBRS/_downloads/MRW_ADDS.zip",
    "type": "http",
    "compression": "zip",
    "conform": {
        "merge": [
            "ST_NAME",
            "ST_TYPE"
        ],
        "lon": "x",
        "lat": "y",
        "number": "HOUSENUM",
        "street": "auto_street",
        "type": "shapefile",
        "postcode": "zipcode"
    }
}